{
  "id": 11756,
  "type": "monster",
  "name": "Mithra der Donnervasall",
  "englishAttribute": "light",
  "localizedAttribute": "LICHT",
  "effectText": "Falls sich diese Karte in deiner Hand befindet: Du kannst diesen Effekt aktivieren; du kannst für den Rest dieses Spielzugs keine Monster als Spezialbeschwörung vom Extra Deck beschwören, zusätzlich beschwöre diese Karte als Spezialbeschwörung und falls du dies tust, beschwöre 1 „Vasall-Spielmarke“ (Typ Donner/LICHT/Stufe 1/ATK 800/DEF 1000) als Spezialbeschwörung in die Verteidigungsposition auf die Spielfeldseite deines Gegners. Falls diese Karte als Tribut für eine Tributbeschwörung angeboten wird: Du kannst diesen Effekt aktivieren; du kannst in diesem Spielzug in deiner Main Phase zusätzlich zu deiner Normalbeschwörung/deinem Setzen für diesen Spielzug 1 Monster als Tributbeschwörung beschwören. (Du kannst diesen Effekt nur einmal pro Spielzug erhalten.) Du kannst jeden Effekt von „Mithra der Donnervasall“ nur einmal pro Spielzug verwenden.",
  "level": 2,
  "atk": 800,
  "def": 1000,
  "properties": [
    "Donner",
    "Effekt"
  ]
}
