{
  "id": 11756,
  "type": "monster",
  "name": "Mithra Vassallo del Tuono",
  "englishAttribute": "light",
  "localizedAttribute": "LUCE",
  "effectText": "Se questa carta Ã¨ nella tua mano: puoi attivare questo effetto; non puoi Evocare Specialmente mostri dall'Extra Deck per il resto di questo turno, inoltre Evoca Specialmente questa carta e, se lo fai, Evoca Specialmente 1 \"Segna-Vassallo\" (Tipo Tuono/LUCE/Livello 1/ATK 800/DEF 1000) sul Terreno del tuo avversario in Posizione di Difesa. Se questa carta viene offerta come Tributo per un'Evocazione tramite Tributo: puoi attivare questo effetto; puoi Evocare tramite Tributo 1 mostro durante la tua Main Phase in questo turno, in aggiunta alla tua Evocazione Normale/posizionamento in questo turno. (Puoi guadagnare questo effetto una sola volta per turno.) Puoi utilizzare ogni effetto di \"Mithra Vassallo del Tuono\" una sola volta per turno.",
  "level": 2,
  "atk": 800,
  "def": 1000,
  "properties": [
    "Tuono",
    "Effetto"
  ]
}
