{
  "id": 11756,
  "type": "monster",
  "name": "Mithra, o Vassalo do Trovão",
  "englishAttribute": "light",
  "localizedAttribute": "LUZ",
  "effectText": "Se este card estiver na sua mão: você pode ativar este efeito; você não pode Invocar por Invocação-Especial monstros do Deck Adicional pelo resto deste turno e, além disso, Invoque este card por Invocação-Especial e, se isso acontecer, Invoque por Invocação-Especial 1 \"Ficha Vassalo\" (Tipo Trovão/LUZ/Nível 1/ATK 800/DEF 1000) no campo do seu oponente em Posição de Defesa. Se este card for oferecido como Tributo para uma Invocação-Tributo: você pode ativar este efeito; você pode Invocar 1 monstro por Invocação-Tributo durante sua Fase Principal deste turno, em adição à sua Invocação-Normal/Baixar (padrão). (Você só pode se aproveitar deste efeito uma vez por turno.) Você só pode usar cada efeito de \"Mithra, o Vassalo do Trovão\" uma vez por turno.",
  "level": 2,
  "atk": 800,
  "def": 1000,
  "properties": [
    "Trovão",
    "Efeito"
  ]
}
