{
  "id": 11756,
  "type": "monster",
  "name": "Mithra le Vassal du Tonnerre",
  "englishAttribute": "light",
  "localizedAttribute": "LUMIÈRE",
  "effectText": "Si cette carte est dans votre main : vous pouvez activer cet effet ; vous ne pouvez pas Invoquer Spécialement de monstres depuis l'Extra Deck le reste de ce tour, et aussi, Invoquez Spécialement cette carte, et si vous le faites, Invoquez Spécialement 1 \"Jeton Vassal\" (Type Tonnerre/LUMIÈRE/Niveau 1/ATK 800 /DEF 1000) sur le Terrain de votre adversaire en Position de Défense. Si cette carte est Sacrifiée pour une Invocation Sacrifice : vous pouvez activer cet effet ; vous pouvez Invoquer par Sacrifice 1 monstre durant votre Main Phase ce tour, en plus de votre Invocation/Pose Normale ce tour. (Vous ne pouvez gagner cet effet qu'une fois par tour.) Vous ne pouvez utiliser chaque effet de \"Mithra le Vassal du Tonnerre\" qu'une fois par tour.",
  "level": 2,
  "atk": 800,
  "def": 1000,
  "properties": [
    "Tonnerre",
    "Effet"
  ]
}
